{
  "rows": [
    {
      "citation_key": "sandvedsmith2026noself",
      "claim_count": 4,
      "evidence_status": "source_anchor",
      "id": "no_self_evidence_preprint",
      "role": "primary formal target",
      "track_count": 8,
      "tracks": {
        "bmr": true,
        "compassion_proxy": true,
        "contemplative_inquiry": false,
        "criticality": true,
        "evidence_ceiling": false,
        "limitations": false,
        "paper_source": true,
        "practice_protocols": true,
        "pymdp": false,
        "qfep": true,
        "qrf": true,
        "scholarship": false,
        "separation_prior": true,
        "validation": false
      }
    },
    {
      "citation_key": "fields2022qfep",
      "claim_count": 1,
      "evidence_status": "formal_background",
      "id": "qfep_generic_quantum_systems",
      "role": "qFEP foundation",
      "track_count": 3,
      "tracks": {
        "bmr": false,
        "compassion_proxy": false,
        "contemplative_inquiry": false,
        "criticality": false,
        "evidence_ceiling": false,
        "limitations": false,
        "paper_source": false,
        "practice_protocols": false,
        "pymdp": false,
        "qfep": true,
        "qrf": true,
        "scholarship": false,
        "separation_prior": false,
        "validation": true
      }
    },
    {
      "citation_key": "fields2023quantumframe",
      "claim_count": 1,
      "evidence_status": "formal_background",
      "id": "quantum_frame_problem",
      "role": "separability and contextuality boundary",
      "track_count": 4,
      "tracks": {
        "bmr": false,
        "compassion_proxy": false,
        "contemplative_inquiry": false,
        "criticality": false,
        "evidence_ceiling": false,
        "limitations": true,
        "paper_source": true,
        "practice_protocols": false,
        "pymdp": false,
        "qfep": false,
        "qrf": true,
        "scholarship": false,
        "separation_prior": true,
        "validation": false
      }
    },
    {
      "citation_key": "friston2010free",
      "claim_count": 1,
      "evidence_status": "theoretical_background",
      "id": "free_energy_principle",
      "role": "classical FEP background",
      "track_count": 3,
      "tracks": {
        "bmr": true,
        "compassion_proxy": false,
        "contemplative_inquiry": false,
        "criticality": false,
        "evidence_ceiling": false,
        "limitations": true,
        "paper_source": false,
        "practice_protocols": false,
        "pymdp": false,
        "qfep": true,
        "qrf": false,
        "scholarship": false,
        "separation_prior": false,
        "validation": false
      }
    },
    {
      "citation_key": "friston2023fep_simpler",
      "claim_count": 2,
      "evidence_status": "theoretical_background",
      "id": "free_energy_principle_simpler",
      "role": "contemporary FEP and Markov-blanket framing with bounded interpretation",
      "track_count": 4,
      "tracks": {
        "bmr": true,
        "compassion_proxy": false,
        "contemplative_inquiry": false,
        "criticality": false,
        "evidence_ceiling": false,
        "limitations": true,
        "paper_source": true,
        "practice_protocols": false,
        "pymdp": false,
        "qfep": true,
        "qrf": false,
        "scholarship": false,
        "separation_prior": false,
        "validation": false
      }
    },
    {
      "citation_key": "possati2025markovblanketdensity",
      "claim_count": 2,
      "evidence_status": "theoretical_background",
      "id": "markov_blanket_density_fep",
      "role": "Markov-blanket density and FEP boundary background",
      "track_count": 3,
      "tracks": {
        "bmr": false,
        "compassion_proxy": false,
        "contemplative_inquiry": false,
        "criticality": false,
        "evidence_ceiling": false,
        "limitations": true,
        "paper_source": true,
        "practice_protocols": false,
        "pymdp": false,
        "qfep": true,
        "qrf": false,
        "scholarship": false,
        "separation_prior": false,
        "validation": false
      }
    },
    {
      "citation_key": "beck2025dynamicmarkovblanket",
      "claim_count": 2,
      "evidence_status": "theoretical_background",
      "id": "dynamic_markov_blanket_detection",
      "role": "dynamic Markov-blanket detection background and boundary-identification caution",
      "track_count": 3,
      "tracks": {
        "bmr": false,
        "compassion_proxy": false,
        "contemplative_inquiry": false,
        "criticality": false,
        "evidence_ceiling": false,
        "limitations": true,
        "paper_source": true,
        "practice_protocols": false,
        "pymdp": false,
        "qfep": false,
        "qrf": false,
        "scholarship": false,
        "separation_prior": false,
        "validation": true
      }
    },
    {
      "citation_key": "hohwy2016self",
      "claim_count": 1,
      "evidence_status": "theoretical_background",
      "id": "self_evidencing_brain",
      "role": "self-evidencing and evidentiary-boundary background",
      "track_count": 3,
      "tracks": {
        "bmr": false,
        "compassion_proxy": false,
        "contemplative_inquiry": false,
        "criticality": false,
        "evidence_ceiling": false,
        "limitations": true,
        "paper_source": true,
        "practice_protocols": false,
        "pymdp": false,
        "qfep": false,
        "qrf": false,
        "scholarship": false,
        "separation_prior": true,
        "validation": false
      }
    },
    {
      "citation_key": "hohwy2026selfevidencingagent",
      "claim_count": 1,
      "evidence_status": "theoretical_background",
      "id": "self_evidencing_agent_monograph",
      "role": "self-evidencing agent background and organismic-function boundary",
      "track_count": 4,
      "tracks": {
        "bmr": false,
        "compassion_proxy": false,
        "contemplative_inquiry": true,
        "criticality": false,
        "evidence_ceiling": false,
        "limitations": true,
        "paper_source": true,
        "practice_protocols": false,
        "pymdp": false,
        "qfep": false,
        "qrf": false,
        "scholarship": false,
        "separation_prior": true,
        "validation": false
      }
    },
    {
      "citation_key": "friston2016active",
      "claim_count": 1,
      "evidence_status": "methodological_background",
      "id": "active_inference_learning",
      "role": "habit formation and policy-precision background",
      "track_count": 4,
      "tracks": {
        "bmr": true,
        "compassion_proxy": false,
        "contemplative_inquiry": false,
        "criticality": false,
        "evidence_ceiling": false,
        "limitations": true,
        "paper_source": false,
        "practice_protocols": false,
        "pymdp": true,
        "qfep": false,
        "qrf": false,
        "scholarship": false,
        "separation_prior": true,
        "validation": false
      }
    },
    {
      "citation_key": "parr2022active",
      "claim_count": 1,
      "evidence_status": "theoretical_background",
      "id": "active_inference_book",
      "role": "active-inference notation and free-energy decomposition",
      "track_count": 3,
      "tracks": {
        "bmr": true,
        "compassion_proxy": false,
        "contemplative_inquiry": false,
        "criticality": false,
        "evidence_ceiling": false,
        "limitations": false,
        "paper_source": false,
        "practice_protocols": false,
        "pymdp": true,
        "qfep": true,
        "qrf": false,
        "scholarship": false,
        "separation_prior": false,
        "validation": false
      }
    },
    {
      "citation_key": "dacosta2020discrete",
      "claim_count": 2,
      "evidence_status": "methodological_background",
      "id": "discrete_active_inference_synthesis",
      "role": "discrete active-inference A/B/C/D implementation background",
      "track_count": 3,
      "tracks": {
        "bmr": true,
        "compassion_proxy": false,
        "contemplative_inquiry": false,
        "criticality": false,
        "evidence_ceiling": false,
        "limitations": false,
        "paper_source": false,
        "practice_protocols": false,
        "pymdp": true,
        "qfep": false,
        "qrf": false,
        "scholarship": false,
        "separation_prior": false,
        "validation": true
      }
    },
    {
      "citation_key": "friston2015epistemic",
      "claim_count": 1,
      "evidence_status": "theoretical_background",
      "id": "epistemic_value_policy_selection",
      "role": "expected free energy and policy-selection background",
      "track_count": 3,
      "tracks": {
        "bmr": true,
        "compassion_proxy": false,
        "contemplative_inquiry": false,
        "criticality": false,
        "evidence_ceiling": false,
        "limitations": false,
        "paper_source": false,
        "practice_protocols": false,
        "pymdp": true,
        "qfep": true,
        "qrf": false,
        "scholarship": false,
        "separation_prior": false,
        "validation": false
      }
    },
    {
      "citation_key": "heins2022pymdp",
      "claim_count": 1,
      "evidence_status": "implementation_anchor",
      "id": "pymdp_joss",
      "role": "runtime and implementation anchor",
      "track_count": 2,
      "tracks": {
        "bmr": false,
        "compassion_proxy": false,
        "contemplative_inquiry": false,
        "criticality": false,
        "evidence_ceiling": false,
        "limitations": false,
        "paper_source": false,
        "practice_protocols": false,
        "pymdp": true,
        "qfep": false,
        "qrf": false,
        "scholarship": false,
        "separation_prior": false,
        "validation": true
      }
    },
    {
      "citation_key": "giacomini2019qrf",
      "claim_count": 1,